{
  "$schema": "../schemas/ingredient.schema.json",
  "schema_version": "1.0.0",
  "id": "piece-of-ginger-peeled-and-finely-chopped",
  "name": "Piece of ginger peeled and finely chopped",
  "categories": [
    "baking"
  ],
  "seasons": [
    "year-round"
  ],
  "default_unit": "g",
  "notes": "Category, seasonality, default unit, and allergens were inferred during automatic recipe promotion."
}
