{
  "$schema": "../schemas/ingredient.schema.json",
  "schema_version": "1.0.0",
  "id": "aubergines-cut-into-thin-rounds",
  "name": "Aubergines cut into thin rounds",
  "categories": [
    "other"
  ],
  "seasons": [
    "year-round"
  ],
  "default_unit": "large",
  "notes": "Category, seasonality, default unit, and allergens were inferred during automatic recipe promotion."
}
