{
  "$schema": "../schemas/ingredient.schema.json",
  "schema_version": "1.0.0",
  "id": "sheets-puff-pastry",
  "name": "Sheets puff pastry",
  "categories": [
    "other"
  ],
  "seasons": [
    "year-round"
  ],
  "notes": "Category, seasonality, default unit, and allergens were inferred during automatic recipe promotion."
}
