{
  "$schema": "../schemas/ingredient.schema.json",
  "schema_version": "1.0.0",
  "id": "fresh-hot-red-chile-pepper",
  "name": "Fresh hot red chile pepper",
  "categories": [
    "spice"
  ],
  "seasons": [
    "year-round"
  ],
  "notes": "Category, seasonality, default unit, and allergens were inferred during automatic recipe promotion."
}
