{
  "$schema": "../schemas/ingredient.schema.json",
  "schema_version": "1.0.0",
  "id": "chapatti-flour",
  "name": "Chapatti flour",
  "categories": [
    "baking"
  ],
  "seasons": [
    "year-round"
  ],
  "default_unit": "g",
  "allergens": [
    "wheat"
  ],
  "notes": "Category, seasonality, default unit, and allergens were inferred during automatic recipe promotion."
}
