{
  "$schema": "../schemas/ingredient.schema.json",
  "schema_version": "1.0.0",
  "id": "complete-buttermilk-pancake-mix",
  "name": "Complete buttermilk pancake mix",
  "categories": [
    "dairy"
  ],
  "seasons": [
    "year-round"
  ],
  "default_unit": "cup",
  "allergens": [
    "milk"
  ],
  "notes": "Category, seasonality, default unit, and allergens were inferred during automatic recipe promotion."
}
