{
  "$schema": "../schemas/ingredient.schema.json",
  "schema_version": "1.0.0",
  "id": "sweet-eating-apples-about-600g",
  "name": "Sweet eating apples (about 600g)",
  "categories": [
    "produce"
  ],
  "seasons": [
    "fall"
  ],
  "notes": "Category, seasonality, default unit, and allergens were inferred during automatic recipe promotion."
}
