{
  "$schema": "../schemas/ingredient.schema.json",
  "schema_version": "1.0.0",
  "id": "orange-or-3-clementines",
  "name": "Orange or 3 clementines",
  "categories": [
    "produce"
  ],
  "seasons": [
    "winter",
    "year-round"
  ],
  "notes": "Category, seasonality, default unit, and allergens were inferred during automatic recipe promotion."
}
