{
  "$schema": "../schemas/ingredient.schema.json",
  "schema_version": "1.0.0",
  "id": "cauliflowers-trimmed",
  "name": "Cauliflowers trimmed",
  "categories": [
    "produce"
  ],
  "seasons": [
    "fall",
    "winter"
  ],
  "default_unit": "medium",
  "notes": "Category, seasonality, default unit, and allergens were inferred during automatic recipe promotion."
}
