{
  "$schema": "../schemas/ingredient.schema.json",
  "schema_version": "1.0.0",
  "id": "dried-mixed-herbs",
  "name": "Dried mixed herbs",
  "categories": [
    "other"
  ],
  "seasons": [
    "year-round"
  ],
  "default_unit": "tablespoon",
  "notes": "Category, seasonality, default unit, and allergens were inferred during automatic recipe promotion."
}
