{
  "$schema": "../schemas/ingredient.schema.json",
  "schema_version": "1.0.0",
  "id": "fresh-basil-leaves",
  "name": "Fresh basil leaves",
  "categories": [
    "herb"
  ],
  "seasons": [
    "summer",
    "fall"
  ],
  "default_unit": "cup",
  "notes": "Category, seasonality, default unit, and allergens were inferred during automatic recipe promotion."
}
