{
  "$schema": "../schemas/ingredient.schema.json",
  "schema_version": "1.0.0",
  "id": "bunch-of-sage-leaves-picked",
  "name": "Bunch of sage leaves picked",
  "categories": [
    "grain"
  ],
  "seasons": [
    "year-round"
  ],
  "default_unit": "small",
  "notes": "Category, seasonality, default unit, and allergens were inferred during automatic recipe promotion."
}
