{
  "$schema": "../schemas/ingredient.schema.json",
  "schema_version": "1.0.0",
  "id": "ground-multi-colored-peppercorns",
  "name": "Ground multi-colored peppercorns",
  "categories": [
    "spice"
  ],
  "seasons": [
    "year-round"
  ],
  "default_unit": "teaspoon",
  "notes": "Category, seasonality, default unit, and allergens were inferred during automatic recipe promotion."
}
