{
  "$schema": "../schemas/ingredient.schema.json",
  "schema_version": "1.0.0",
  "id": "red-peppers-chopped-into-thin-strips",
  "name": "Red peppers chopped into thin strips",
  "categories": [
    "spice"
  ],
  "seasons": [
    "year-round"
  ],
  "notes": "Category, seasonality, default unit, and allergens were inferred during automatic recipe promotion."
}
