{
  "$schema": "../schemas/ingredient.schema.json",
  "schema_version": "1.0.0",
  "id": "leeks-about-500g",
  "name": "Leeks (about 500g)",
  "categories": [
    "produce"
  ],
  "seasons": [
    "fall",
    "winter"
  ],
  "notes": "Category, seasonality, default unit, and allergens were inferred during automatic recipe promotion."
}
