{
  "$schema": "../schemas/ingredient.schema.json",
  "schema_version": "1.0.0",
  "id": "blueberries",
  "name": "Blueberries",
  "categories": [
    "produce"
  ],
  "seasons": [
    "summer"
  ],
  "default_unit": "pint",
  "notes": "Category, seasonality, default unit, and allergens were inferred during automatic recipe promotion."
}
