{
  "$schema": "../schemas/ingredient.schema.json",
  "schema_version": "1.0.0",
  "id": "or-2-smaller-banana-shallots-finely-chopped",
  "name": "Or 2 smaller banana shallots finely chopped",
  "categories": [
    "produce"
  ],
  "seasons": [
    "year-round"
  ],
  "default_unit": "large",
  "notes": "Category, seasonality, default unit, and allergens were inferred during automatic recipe promotion."
}
