{
  "$schema": "../schemas/ingredient.schema.json",
  "schema_version": "1.0.0",
  "id": "sweet-potatoes-we-used-purple-but-any-will-work",
  "name": "Sweet potatoes (we used purple but any will work)",
  "categories": [
    "produce"
  ],
  "seasons": [
    "fall",
    "winter"
  ],
  "default_unit": "medium",
  "notes": "Category, seasonality, default unit, and allergens were inferred during automatic recipe promotion."
}
