{
  "$schema": "../schemas/ingredient.schema.json",
  "schema_version": "1.0.0",
  "id": "beef-chuck-roast",
  "name": "Beef chuck roast",
  "categories": [
    "protein"
  ],
  "seasons": [
    "year-round"
  ],
  "default_unit": "pounds",
  "notes": "Category, seasonality, default unit, and allergens were inferred during automatic recipe promotion."
}
