{
  "$schema": "../schemas/ingredient.schema.json",
  "schema_version": "1.0.0",
  "id": "neutral-oil",
  "name": "Neutral oil",
  "categories": [
    "oil"
  ],
  "seasons": [
    "year-round"
  ],
  "default_unit": "tbsp",
  "notes": "Category, seasonality, default unit, and allergens were inferred during automatic recipe promotion."
}
