{
  "$schema": "../schemas/ingredient.schema.json",
  "schema_version": "1.0.0",
  "id": "strawberries-hulled-and-sliced",
  "name": "Strawberries hulled and sliced",
  "categories": [
    "produce"
  ],
  "seasons": [
    "spring",
    "summer"
  ],
  "default_unit": "g",
  "notes": "Category, seasonality, default unit, and allergens were inferred during automatic recipe promotion."
}
